ID,Text,Countries,Sentences,Characters
0,"One evening, Sarah, an archaeologist from Norway made a surprising discovery about ancient trade routes between Sweden and Norway. As per her research, the artifacts that were found in Norway were identical to those in Sweden, indicating a deep-rooted cultural connection between Sweden and Norway. This piqued the interest of her colleague, James, who was from Canada. He had been researching the indigenous tribes of Canada and found many similarities with tribes from his neighboring country, the United States. James had always been interested in the historical ties between Canada and United States, and his study further confirmed the age-old connections between the two countries. Upon hearing James's story, Sarah shared a fascinating anecdote from her travels in Portugal. She recalled how locals loved to tell the tale of the shared history between Spain and Portugal. Her anecdotes about Spain and Portugal echoed the same sense of shared culture and past, just like in the case of Norway and Sweden, and Canada and United States. Their conversation reminded James of his stay in South Korea, where he had learned about the close relationship between North Korea and South Korea, despite their current political divide. He recalled stories about the shared history of North Korea and South Korea, whose deep-seated cultural ties transcended political boundaries. Sarah, who had been to Australia, reciprocated with her own experiences of the bond between Australia and New Zealand. She described how, despite geographical separation, Australia and New Zealand shared a unique camaraderie and close historical ties. As they exchanged stories, their conversation moved to South Africa and its various connections with its neighbouring country, Zimbabwe. Sarah shared stories she had heard about the intricate bond between South Africa and Zimbabwe, showcasing the age-old interactions between these two nations. It left them both reflecting on the timeless bonds that connect nations across the world, from Norway to Australia, Canada to Zimbabwe, and all the countries in between.","[Norway, Sweden, Norway, Norway, Sweden, Sweden, Norway, Canada, Canada, United States, Canada, United States, Portugal, Spain, Portugal, Spain, Portugal, Norway, Sweden, Canada, United States, South Korea, North Korea, South Korea, North Korea, South Korea, Australia, Australia, New Zealand, Australia, New Zealand, South Africa, Zimbabwe, South Africa, Zimbabwe, Norway, Australia, Canada, Zimbabwe]",15,2090
1,"My friend, Alex from Peru, once recounted his journey to Argentina where he learned about the strong cultural ties between Argentina and Brazil due to their shared history. He spoke fondly of his time in Argentina and Brazil, marveling at the similar music, dance, and culinary traditions that seamlessly bridged the borders of these countries. It reminded me of a documentary I'd watched about the ancient Silk Road that spanned across Iran and China. It touched upon the shared historical narratives of Iran and China, highlighting how goods, ideas, and culture flowed between these two countries for centuries. Intriguingly, the documentary also brought up some parallels between this eastern route and the vibrant exchange between Italy and France during the Renaissance. The cultural and intellectual bonds between Italy and France were indeed profound, just as the resilient trade relations that existed between the United States and Canada. The United States and Canada, apart from their geographical proximity, shared an economic bond that strongly influenced their policies and international standing. Similarly, the ties between Australia and New Zealand shed light on their gestalt identity in the Pacific region. Despite their unique characteristics, Australia and New Zealand were often viewed as a single entity due to their remarkably similar backgrounds in terms of culture, language, and colonial history. Inspired by these chronicles of interconnectedness, I decided to delve deeper into history and found a fascinating account of how Ukraine and Poland had influenced each other through years of coexistence. Despite their tumultuous past, Ukraine and Poland shared a cultural tapestry that was deeply woven into their histories. It was quite similar to the complex relationship between North Korea and South Korea, which, despite their political differences, shared common heritage and traditions. Thus, from Argentina to South Korea, the world was an intricate web of countries intertwined with each other through shared histories, cultures, and sometimes, shared destinies.","[Peru, Argentina, Argentina, Brazil, Argentina, Brazil, Iran, China, Iran, China, Italy, France, Italy, France, United States, Canada, United States, Canada, Australia, New Zealand, Australia, New Zealand, Ukraine, Poland, Ukraine, Poland, North Korea, South Korea, Argentina, South Korea]",13,2095
2,"Annie, a marine biologist from Ireland, had always been fascinated by the diverse sealife surrounding the coasts of Australia. She often said that the waters of Australia were some of the most biodiverse in the world, enticing researchers like her from faraway lands like Ireland. Through her explorations, she developed a particular interest in the migratory patterns of certain species, noting that they often ventured towards New Zealand. Annie noticed that from Australia, these marine creatures would cross oceans to reach the coasts of New Zealand, proving the interconnectedness of these ecosystems. Driven by this curiosity, she published her research, attracting the attention of a fellow scientist, Greg, from Canada. Inspired by her findings, Greg shared his own studies on migration patterns, noting a similar scenario between Canada and the United States. He'd found that many animal species in Canada would cross the border into the United States during certain seasons, emphasizing the interplay between these two nations. Annie and Greg started to collaborate, which led their research towards Mexico, where they discovered another fascinating migration phenomenon. They found it intriguing that birds from the United States would fly south, bypassing their own habitats to spend the winter in the warmer climates of Mexico. Their research in Mexico led them to another colleague, Maria, from Spain. Maria had been studying the movements of the Iberian Lynx which often roamed between Spain and Portugal. Maria's research had shown that just like the animals in North America, the Lynx in Spain had established territories in Portugal. Intrigued by the similarities, they expanded their study to cover the movement of bird species between Belgium and the Netherlands. Just as they'd seen in the Americas, they noticed that certain species of birds in Belgium would travel to the Netherlands during certain periods of the year. These fascinating findings opened up new dimensions of understanding for the interconnectedness of the world. From the sealife in Australia to the birds in Belgium, the animal kingdom had its own ways of establishing connections between countries.","[Ireland, Australia, Australia, Ireland, New Zealand, Australia, New Zealand, Canada, Canada, United States, Canada, United States, Mexico, United States, Mexico, Mexico, Spain, Spain, Portugal, Spain, Portugal, Belgium, Netherlands, Belgium, Netherlands, Australia, Belgium]",16,2190
3,"During their adventurous journey around the world, Jack and Emily first found themselves in the vibrant markets of India, enamoured by the rich traditions from India reflected in every corner. Their journey then led them to the bustling cityscapes of China, filled with modern marvels that somehow coexisted with ancient traditions from China's past. They then travelled to Australia, where they got lost in the wilderness, and shared stories of the rich biodiversity found in Australia under the southern constellations. Their travel then took them to Argentina, where they were captivated by the diversity of landscapes, from the colossal mountains to the serene lakes of Argentina. They couldn't help but notice the stark contrast to Brazil, which boasted its own unique geographical features and diverse environments, mirroring the diversity of lifestyles in Brazil. Jack, recalling his childhood passion, mentioned his fondness for Italy and its rich history. Emily, sharing his sentiment, mentioned the transcendent beauty of Italy's architecture and the remarkable tales from Italy's past. Soon, their discussion shifted to the dynamic nightlife of South Korea, which they said was unlike anything they had experienced before. South Korea, they described, was the perfect blend of the old and the new, where rich traditions met modern influences. They expressed their shared love for Ireland, with its lush green landscapes and the warm hospitality of the people of Ireland. Their tales also touched upon the unparalleled tranquility of Switzerland and the cultural harmony they found there. Switzerland, they both agreed, was a testament to the beauty of diversity, coexistence and peace. Their curiosity then led them to discuss their memorable visit to Mexico, and the unmatched flavors of cuisine from Mexico that left an indelible mark on their taste buds. As the night grew darker, their conversation veered towards the mystical landscapes of Egypt, where ancient history whispered from every corner of Egypt. As they traversed through their memories, they couldn't help but look forward to their upcoming trip to Kenya, hoping that their experiences in Kenya would be just as enriching and unforgettable. As they parted for the night, they went to sleep with dreams of their world journey, from India to Kenya, brimming in their hearts.","[India, India, China, China, Australia, Australia, Argentina, Argentina, Brazil, Brazil, Italy, Italy, Italy, South Korea, South Korea, Ireland, Ireland, Switzerland, Switzerland, Mexico, Mexico, Egypt, Egypt, Kenya, Kenya, India, Kenya]",16,2350
4,"The origins of James, an anthropologist from Australia, traced back to Ireland, a land of heritage and folklore. He often marveled at the similarities between the indigenous cultures of Australia and the rich, traditional societies of Ireland. His fascination grew more profound when he learned about the ancient ties between Ireland and the United Kingdom. Both the United Kingdom and Ireland, he discovered, had histories deeply intertwined, from shared rulers to common cultural practices. His friend, Laura, an archaeologist from the United States, shared his interest in tracing historical connections between nations. She had closely studied the cultural exchanges between the United States and Mexico, intrigued by their shared border and the resultant blend of customs and traditions. The bond between the United States and Mexico was a testament to their shared history of migrations, trade, and even conflicts. Laura also recounted her research on Peru and the cultural parallels it held with Brazil. She discovered that both Peru and Brazil shared ties through the Amazon rainforest, with indigenous communities trading goods and knowledge over centuries. James, on his part, spoke about his recent research on the historical relationship between South Africa and Zimbabwe. He found that South Africa and Zimbabwe shared a lot of similarities in terms of language, culture, and history, owing to their geographical proximity. Drawing on her experience from a trip to Asia, Laura mentioned her encounter with the intriguing links between China and North Korea. She noted that China and North Korea, despite their political differences, shared historical and cultural ties that dated back centuries. The conversation ended on a lighter note, with both of them reminiscing about their culinary adventures in Italy and France. Both Italy and France, they agreed, had unparalleled culinary scenes, deeply rooted in their culture and history. Their discussion underlined the beauty of shared narratives and cultural exchanges across the world.","[Australia, Ireland, Australia, Ireland, Ireland, United Kingdom, United Kingdom, Ireland, United States, United States, Mexico, United States, Mexico, Peru, Brazil, Peru, Brazil, South Africa, Zimbabwe, South Africa, Zimbabwe, China, North Korea, China, North Korea, Italy, France, Italy, France]",16,2048
5,"On his journey across the globe, Mark found himself fascinated by the cultural blend in Argentina where the tango originated. His time in Argentina sparked his interest in Brazil, and he took a short plane ride to the country known for its vast Amazon rainforest. The allure of Brazil was intoxicating, its vibrant festivals and unique wildlife were unlike anything he'd previously seen. He'd soon learn that the wildlife in Australia, however, was equally captivating. While in Australia, Mark found himself charmed by the affectionate kangaroos and aloof koalas. After Australia, he headed towards Asia, beginning at the vibrant country of India. India's cultural diversity, historical grandeur, and the warmth of the people enticed him to spend more time exploring the country. Another country that captured his heart in the same way was China, with its rich history and splendid landscapes. China amazed him with its ancient monuments and the Great Wall, leaving him yearning for more such experiences. Such yearning led him to Egypt, home to the majestic Pyramids. The history and mysteries that shrouded Egypt kept him intrigued, so much so that he extended his stay. Encouraged by his experiences in Egypt, Mark decided to venture further into the landscapes of Africa and arrived at Kenya. In Kenya, he was awestruck by the vast savannahs and spectacular wildlife. His adventures in Kenya made him realize the untapped beauty of Africa, prompting him to extend his African journey to South Africa. In South Africa, he was spellbound by the natural beauty of the landscapes, making him fall in love with Africa. His next destination was Europe, where he found himself fascinated by the architectural grandeur of Italy and the historical stories that surrounded every alleyway. Italy, with its enchanting cities and delicious food, left an unforgettable impression on him. The final leg of his journey led him to cold but beautiful Norway, where he witnessed the spectacular Northern Lights, ending his journey on a high note.","[Argentina, Argentina, Brazil, Brazil, Australia, Australia, Australia, India, India, China, China, Egypt, Egypt, Egypt, Kenya, Kenya, Kenya, South Africa, South Africa, Italy, Italy, Norway]",18,2032
6,"As Hannah walked down the bustling streets of Tokyo, Japan, she felt the energy of the city. Japan, with its blend of tradition and modernity, was nothing like her quiet hometown in Ireland. Upon returning to Ireland, she was greeted with the serene green landscape, a stark contrast to the skyscrapers of Japan, but equally beautiful in its own way. After her time in Japan and Ireland, she couldn't help but feel restless, wanting to explore more of the world. Her next adventure took her to the vibrant city of Rio in Brazil, famed for its lively carnivals. Brazil’s rich culture and friendly people left a deep impression on Hannah, making her yearn for more such experiences. Her friend, Alejandro from Mexico, suggested that she visit his home country next. In Mexico, she was awestruck by the historic architecture and the vibrant, bustling markets. The food of Mexico, in particular, was a revelation to her. After Mexico, she headed to France. France's elegance, be it in their language, fashion, or gastronomy, left her fascinated. She spent hours sitting in cafes in France, watching the world go by, and feeling a sense of peace that she hadn't felt for a long time. After France, her journey took her to the far East, to China. In China, she found a dynamic cityscape intermingling with centuries-old architecture. China’s history fascinated her, and her journey through the country felt like traveling through time. Her last stop was Australia and she spent weeks exploring the diverse landscapes of the country. From the bustling cities to the serene Outback, Australia was a beautiful end to her travels. Her experiences in Japan, Ireland, Brazil, Mexico, France, China, and Australia had given her a new perspective, a deeper appreciation for the beauty in diversity.","[Japan, Japan, Ireland, Ireland, Japan, Japan, Ireland, Brazil, Brazil, Mexico, Mexico, Mexico, Mexico, France, France, France, France, China, China, China, Australia, Australia, Japan, Ireland, Brazil, Mexico, France, China, Australia]",18,1784
7,"During his travels in Italy, John discovered a remarkable tale about the intricate trade networks of the past that connected Italy, Greece, and Turkey. Drawn in by the fascinating history, he began researching further about Italy, particularly its ancient maritime links with Greece and Turkey, as well as their shared cultural heritage. This sparked a memory in his friend Anna from the United States, who'd been studying the historical exchanges between the indigenous cultures of the United States and Canada. She mentioned how these groups from both the United States and Canada had a rich history of sharing knowledge, customs and even conflict, demonstrating an age-old connection between the two countries. Fascinated, John shared snippets from his trip to Brazil, where he'd learned about the cultural and historical ties between Brazil and Argentina. He revealed that despite their political differences, Brazil and Argentina share profound cultural links, with their histories deeply intertwined. This reminded Anna of her journey to the United Kingdom. She vividly recalled an exhibition she had visited in the United Kingdom, showcasing the country's historic ties with Ireland. It was intriguing, she narrated, how the United Kingdom and Ireland, despite their tumultuous history, have shared and shaped each other's destinities. John then told Anna about his visit to Egypt, where he encountered the millennia-old bond between Egypt and Israel. Intriguingly, Egypt and Israel, despite their conflicts, have a shared history that can be traced back to the times of antiquity. Finally, Anna ended the conversation with a quirky fact about Australia and New Zealand. She revealed that despite their friendly rivalry on the sports field, Australia and New Zealand share a deeply ingrained kinship, both in terms of history and culture. Their conversation, filled with tales from Italy to Australia, was a testament to the interconnectedness of our world's history through the lens of different countries.","[Italy, Italy, Greece, Turkey, Italy, Greece, Turkey, United States, United States, Canada, United States, Canada, Brazil, Brazil, Argentina, Brazil, Argentina, United Kingdom, United Kingdom, Ireland, United Kingdom, Ireland, Egypt, Egypt, Israel, Egypt, Israel, Australia, New Zealand, Australia, New Zealand, Italy, Australia]",14,2014
8,"Upon his visit to Norway, David, an avid history buff, learned that the Vikings, who hailed from both Norway and Sweden, were not just raiders and traders, but also skillful navigators who discovered new lands. Both Norway and Sweden shared a rich Viking heritage, with numerous historic sites and artifacts revealing their past. He later shared these insights with his friend Susan, who lived in Canada and was equally passionate about history. She told him about the first European settlers in Canada, most of whom were from France and United Kingdom. Both France and the United Kingdom had made significant contributions to the early development of Canada, she explained. Her fascination with history also led her to explore the ancient civilizations of Egypt, with its magnificent pyramids and intriguing hieroglyphics. She mentioned that her visit to Egypt opened her eyes to the true grandeur of ancient civilizations, something she felt was often overlooked. David shared her sentiment, recounting his own experiences in Greece, where he had explored the renowned archaeological sites. He revealed that Greece’s rich history, from its mythical heroes to its philosophical legacy, truly captivated him.  In response, Susan brought up her travels to Mexico, where she got to witness the remnants of the great Mayan civilization. She also spoke about the complex Aztec culture in Mexico, which she found just as fascinating as the Mayans. This discourse on ancient civilizations prompted David to talk about his trip to Italy, famous for its Roman heritage. He said that visiting Italy was like a journey through time, with landmarks and ruins offering a glimpse into the past. They both agreed that whether it's the Viking heritage of Norway and Sweden or the ancient civilizations of Egypt, Greece, Mexico, or Italy, every country has a rich and captivating history to explore and learn from.","[Norway, Norway, Sweden, Norway, Sweden, Canada, Canada, France, United Kingdom, France, United Kingdom, Canada, Egypt, Egypt, Greece, Greece, Mexico, Mexico, Italy, Italy, Norway, Sweden, Egypt, Greece, Mexico, Italy]",14,1898
9,"In the heart of Portugal, Jack, a historian, found aged parchments detailing a fascinating relationship with Spain. The parchments spoke of a time when merchants from Portugal would regularly travel to Spain for trade and cultural exchange, hinting at a deeply entwined history between Portugal and Spain. Jack shared this discovery with his colleague, Laura, an anthropologist from Switzerland who was researching similar cultural exchanges. She had observed that Switzerland historically had a close relationship with Italy. She spoke of trade routes and shared cultural practices that had bridged gaps between Switzerland and Italy for centuries. Intrigued, Jack mentioned an old map he'd found which suggested an age-old connection between the United States and Canada. Apparently, during certain historical periods, the borders between the United States and Canada were fluid, with peoples, culture, and trade often transitioning seamlessly. Laura confessed her interest in Asian histories, particularly those of India and Pakistan. She found it fascinating how India and Pakistan, despite their conflicts, shared a deep-rooted cultural and historical bond. She also mentioned the ancient ties between China and Japan, a relationship marked by both cooperation and conflict, with cultural exchanges and wars shaping the relationship between China and Japan. Jack agreed and shared that he was equally fascinated with the shared history of Australia and New Zealand. The indigenous cultures of Australia and New Zealand, he explained, had rich oral histories that spoke of ancestral spirits crossing the sea between the two countries. As the day ended, they both realized how intertwined the world was, united by shared histories and cultural exchanges from Portugal to New Zealand.","[Portugal, Spain, Portugal, Spain, Portugal, Spain, Switzerland, Switzerland, Italy, Switzerland, Italy, United States, Canada, United States, Canada, India, Pakistan, India, Pakistan, China, Japan, China, Japan, Australia, New Zealand, Australia, New Zealand, Portugal, New Zealand]",13,1786
10,"John, an avid traveler from Canada, had spent his summer exploring the heart of Australia, specifically, the Outback. The vast, arid landscapes of Australia presented a stark contrast to the snow-filled winters of his home in Canada, and he reveled in the difference. He then shared stories of his trip to Brazil, where he fell in love with the vibrant rhythms and the people's warm hospitality. Indeed, Brazil left such a strong impression on him that he visited the country again, this time to explore the dense Amazon rainforest. As John recounted his travels, his friend Sarah, a history buff from the United Kingdom, couldn't help but gush about her trips to Italy and Greece. She explained how she had spent weeks soaking up the culture, history, and mythology of Italy and Greece. Intrigued by Sarah's stories, John revealed his fascination for Northern countries, particularly Norway and Sweden. He cherished his memories of hiking through the scenic landscapes of Norway and the breathtaking fjords of Sweden. Sarah, not to be outdone, discussed her recent visit to Mexico and Cuba. Highlighting the unique colonial architecture of Mexico and the vibrant music scene in Cuba, Sarah couldn't conceal her wanderlust. She ended the conversation by expressing her desire to visit South Korea and Japan. She was particularly interested in the modern cities and ancient temples of South Korea, as well as the unique blend of tradition and technology in Japan. As they parted ways, both agreed to continue exploring and understanding the world, one country at a time.","[Canada, Australia, Australia, Canada, Brazil, Brazil, United Kingdom, Italy, Greece, Italy, Greece, Norway, Sweden, Norway, Sweden, Mexico, Cuba, Mexico, Cuba, South Korea, Japan, South Korea, Japan]",13,1569
