ID,Text,Countries,Sentences,Characters
69,"One sunny afternoon, Emily and Robert, an adventurous couple from Spain, decided to visit the beautiful landscapes of Ireland after hearing stories about its mesmerizing beauty. Their friend, who had traveled throughout Ireland, had shared tales of emerald valleys, ancient castles, and warm-hearted locals, compelling them to see it for themselves. Having experienced the charming sites of Ireland, they set their sights on Argentina, inspired by the journey of their close friend Jack, who had raved about his experiences in Argentina and Brazil. He described Argentina as a place of magnificent mountains and vast pampas, while Brazil offered magical rainforests and vibrant city life, creating an irresistible wanderlust in Emily and Robert. After exploring the stunning sights of Argentina and Brazil, they got an unexpected call from their friend in Australia. She told them about a festival in Australia that celebrated the cultural ties between Australia and New Zealand, where the exchange of arts, music, and cuisines took center stage. Intrigued, Emily and Robert decided to witness this amalgamation of cultures, which further solidified their respect for Australia and New Zealand's bond. They later received word from another friend residing in Belgium who spoke of an exciting event commemorating the historical ties between Belgium and the Netherlands. Intriguingly, both Belgium and the Netherlands had histories steeped in similar traditions of craftsmanship, resulting in shared architectural and artistic styles. Finally, Emily and Robert decided to conclude their journey in South Korea, where a friendly local spoke about the influence of China in their country. He explained that South Korea and China had a dynamic relationship, a product of centuries of trade, and sometimes conflict, that shaped their current culture and way of life. Thus, this epic journey took them from Spain to South Korea, with experiences that deepened their understanding of the world's shared histories.","[Spain, Ireland, Ireland, Ireland, Argentina, Argentina, Brazil, Argentina, Brazil, Argentina, Brazil, Australia, Australia, Australia, New Zealand, Australia, New Zealand, Belgium, Belgium, Netherlands, Belgium, Netherlands, South Korea, China, South Korea, China, Spain, South Korea]",12,2005
70,"In the heart of Africa, there is a story that connects Kenya to Egypt. The tale suggests that the ancient kingdoms of Kenya and Egypt shared a bond, trading goods and knowledge across the harsh desert. Jack, a traveler from Ireland, always dreamt of retracing the steps of these ancient traders, from the humid coasts of Kenya, through the barren Sahara, to the marvels of Egypt. On his journey, he was accompanied by his friend Hiroshi from Japan, who was fascinated by the ancient cultures and their connections. Japan itself had a vibrant history of exchanges with its neighbor, China. Hiroshi would always recount the tales of how samurais from Japan used to visit China to learn new strategies and martial arts. The mention of martial arts brought back memories to Jack about his trip to South Korea, where he experienced the discipline and beauty of Taekwondo. He learned that Taekwondo, despite being indigenous to South Korea, was influenced by ancient martial arts from China. Just as Jack was talking about martial arts, Hiroshi spoke of his visit to the United States, where he saw how baseball, considered America's pastime, had been embraced by Japan. Interestingly, the United States also had a deep connection with Canada, its historical ally and neighbor. Both the United States and Canada not only shared the world's longest international border, but also a rich history of cultural exchange and friendship. It suddenly dawned on Hiroshi and Jack that they were not just travelers, but links in a chain that stretched generations and across the globe, from Kenya to Canada, and from Japan to the United States.","[Kenya, Egypt, Kenya, Egypt, Ireland, Kenya, Egypt, Japan, Japan, China, Japan, China, South Korea, South Korea, China, United States, Japan, United States, Canada, United States, Canada, Kenya, Canada, Japan, United States]",12,1627
71,"John, a renowned historian from the United States, specialized in studying the historical ties among nations. He found himself deeply immersed in researching the bond between North Korea and South Korea, noting that despite their political divide, shared history still tied them together. He discussed his findings with his colleague Lisa, who had an expertise in tracing the historical links between India and Pakistan. Both India and Pakistan share a similar language, culture, and history, suggesting traces of a shared past despite their political differences. These shared elements in culture and history also reminded John of the complex relationship between the United States and Canada. A shared border and common language allowed the United States and Canada to collaborate in various sectors like trade, technology, and arts. Lisa brought up her recent trip to Australia and New Zealand, and their unique relationship, sharing histories of colonialism, indigenous cultures, and a fierce sporting rivalry. She found the bonds Australia and New Zealand shared were reminiscent of the ties between Belgium and the Netherlands, two countries she explored during her sabbatical. Belgium and Netherlands, both located in Western Europe, share a rich history of trade, art, and cultural exchange. They concluded their discussion by drawing parallels with South America, particularly the close alliance and shared cultural history between Argentina and Brazil. They marveled at how interconnected these countries were, from North Korea to Brazil, illustrating the intricate web of shared histories and cultural exchanges across the globe.","[United States, North Korea, South Korea, India, Pakistan, India, Pakistan, United States, Canada, United States, Canada, Australia, New Zealand, Australia, New Zealand, Belgium, Netherlands, Belgium, Netherlands, Argentina, Brazil, North Korea, Brazil]",11,1640
72,"In a quaint coffee shop in Portugal, Alice found herself immersed in a riveting book about the deep-rooted historical rivalry between Portugal and Spain. The book elaborated how despite their disagreements, Portugal and Spain had a shared heritage that was hard to ignore. Her friend Ben, who had lived in both Spain and Portugal, often spoke about the shared traditions and culture that overpowered their differences. Their discussion then shifted to the exotic travel stories of Ben who had recently returned from a trip to China. He spoke about the beautiful landscapes, bustling cities, and enchanting history of China, and how it beautifully contrasted with its neighboring country, Vietnam. The elegance of China and the charm of Vietnam had left a profound impact on him. He also mentioned how Vietnam and China, despite their past conflicts, shared a deep cultural bond. Ben's travel stories reminded Alice of her friend Claire who had recently moved to Canada. Claire had spoken at length about the differences between Canada and the United States; how the two countries, while very close geographically and often compared to one another, had very distinct identities. She shared stories about her experiences in both Canada and the United States, highlighting the unique cultural facets of each nation. Intrigued by such narratives, Alice too expressed her desire to explore these countries. After a day filled with tales from Spain to the United States, they walked out of the coffee shop with a newfound appreciation for the world's diverse cultures and histories.","[Portugal, Portugal, Spain, Portugal, Spain, Spain, Portugal, China, China, Vietnam, China, Vietnam, Vietnam, China, Canada, Canada, United States, Canada, United States, Spain, United States]",12,1576
73,"John, an avid lover of history, had always been fascinated by the ancient civilizations of Egypt and their influence on Greece. The tales of how the Pharaohs' knowledge shaped the philosophies of Greece had amazed him ever since his childhood. His fascination wasn't limited to Egypt and Greece though; he was equally captivated by the historical exchanges between the Persian empires of Iran and the Indus valley civilization in Pakistan. These two countries, Iran and Pakistan, despite being so geographically apart, had a rich and intertwining history. One day, while reading a book on world history, he stumbled upon the cultural and political exchanges between the prosperous kingdoms of India and China in ancient times. The way India and China, two colossal civilizations, had intermingled their philosophies fascinated him. As he delved deeper, he discovered the lesser-known naval expeditions from the royal fleets of China visiting the archipelago of Indonesia, trading silk for spices. These maritime interactions between China and Indonesia reflected the strategic significance of the latter. His interest deepened when he read about the exploration expeditions between the United Kingdom and Australia, with the latter once seen as the ""Land of Golden Opportunities"" by the UK. Intriguingly, the connection wasn't just limited trading but was rather a complex relationship between the United Kingdom and Australia involving colonization, settlement, and later, independence. This led him to learn about the profound relationships between neighboring nations like Portugal and Spain, with their shared culture, history, and rivalry. The more John read about Portugal and Spain, the more he found himself engrossed in their fascinating intertwining histories. He was equally intrigued about the historical bonds between Belgium and the Netherlands, two countries that despite being distinct, shared a common past that was still evident in their culture. These complex ties between Belgium and the Netherlands made him even more passionate about world history. His extensive readings affirmed that the world was wonderfully intricate and deeply interconnected, right from Egypt to the Netherlands.","[Egypt, Greece, Greece, Egypt, Greece, Iran, Pakistan, Iran, Pakistan, India, China, India, China, China, Indonesia, China, Indonesia, United Kingdom, Australia, United Kingdom, Australia, Portugal, Spain, Portugal, Spain, Belgium, Netherlands, Belgium, Netherlands, Egypt, Netherlands]",15,2207
74,"In the peaceful calm of Canada, Bob, a history enthusiast, stumbled across accounts of ancient trading routes between Canada and China. The documents hinted at merchants from China voyaging across the Pacific Ocean to trade with tribes in Canada, creating a bond between these two different worlds. This sparked his curiosity and led him to his friend Maria, a linguist from Brazil who had deep knowledge of ancient languages and cultures. Maria was excited about Bob's discovery as she had recently learned about ancient routes between Brazil and Argentina. These routes were a reflection of the intertwined histories of Brazil and Argentina, supposedly established by indigenous tribes for trade and cultural exchange. Maria then shared an interesting story about the historic relations between Russia and Ukraine, where shared cultural, linguistic, and political experiences have largely influenced their intertwined destinies. This symbiotic relationship between Russia and Ukraine reminded Bob of an ancient story he had heard about the ties between Ireland and the United Kingdom. The story spoke of a time when Ireland and the United Kingdom, despite their tumultuous history, had shared literary and cultural traditions. Maria, further intrigued, shared her travels to the Middle East, specifically to Iran and Iraq, countries inseparable in their shared history and geography. Her tales about Iran and Iraq's common heritage, despite recent conflicts, fascinated him, as they mirrored the similar situation between Israel and Egypt. Israel and Egypt, despite their political differences, have a rich shared history dating back to biblical times. Enraptured by these tales of intertwined histories, both Bob and Maria marveled at how interconnected the world truly is, from Canada's ancient ties with China to Israel's shared history with Egypt.","[Canada, Canada, China, China, Canada, Brazil, Brazil, Argentina, Brazil, Argentina, Russia, Ukraine, Russia, Ukraine, Ireland, United Kingdom, Ireland, United Kingdom, Iran, Iraq, Iran, Iraq, Israel, Egypt, Israel, Egypt, Canada, China, Israel, Egypt]",12,1853
75,"In his youth, John had always been fascinated by the heroic tales of the samurais of Japan. He read voraciously about these warriors from Japan, their rigorous discipline, and their peculiar code of honor. Inspired, he decided to learn more about martial arts and ended up in South Korea, enrolling in a Taekwondo academy. Spending years in South Korea, he noticed parallels between the samurai culture of Japan and the martial philosophy of South Korea. His time in Asia also exposed him to the rich spiritual traditions of India. He was particularly intrigued by yoga from India, which he found to be a potent combination of physical discipline and mental concentration. On his return to the western hemisphere, he met Maria in Peru, who had a similar passion for spirituality and mysticism. She enlightened him about the Inca civilization of Peru and its unique spiritual practices. Intrigued by the Inca civilization, John became fascinated with the Mayan civilization of Mexico. He read books about Mexico, about its ancient pyramids and astronomical knowledge. Maria, inspired by John's interest in ancient civilizations, shared her experiences of visiting the pyramids in Egypt. She described Egypt with such passion that John decided to plan his next adventure there. In Egypt, he found connections with Peru and Mexico, each bound by their ancient civilizations. Through their travels, Maria and John realized how interconnected the world is, from the samurais of Japan to the pyramids of Egypt, and it only deepened their passion for exploration and learning.","[Japan, Japan, South Korea, South Korea, Japan, South Korea, India, India, Peru, Peru, Mexico, Mexico, Egypt, Egypt, Egypt, Peru, Mexico, Japan, Egypt]",14,1569
76,"John was a seasoned traveler and had been to numerous countries around the world. He began his journey in Canada, exploring the vast wilderness and rich cultural heritage of the country. John spent a year in Canada, initially living in the vibrant city of Toronto, then making his way west to the picturesque Rockies. From Canada, he flew to its southern neighbour, the United States, where he was mesmerized by the diversity and spirit of the country. He spent another year traveling through the United States, visiting the bustling cities like New York and Los Angeles, and the beautiful national parks like Yellowstone and Yosemite. From the United States, he ventured further south to Mexico. He was enamored by the history and food culture in Mexico and spent several months traversing the country. The ruins of ancient civilizations in Mexico fascinated him and he learnt about the country's rich past. The next leg of his journey took him to Australia, a land of stunning landscapes and diverse wildlife. John found himself captivated by Australia's unique flora and fauna, and the friendly nature of its people. From Australia, he made his way to Japan. Japan's unique blend of tradition and modernity captured his heart and he spent a sizable chunk of his journey exploring the country. He admired Japan's commitment to its traditions, its technological prowess, and its obsession with perfection. From Japan, he flew to Norway, a country he had always dreamed of visiting. On his first day in Norway, he was awestruck by the fjords and the northern lights. The more he explored Norway, the more he fell in love with the country, its people, and its culture. As he boarded the flight for his next destination, South Africa, he looked back at his journey from Canada to Norway, and was filled with gratitude for the incredible experiences he had had. South Africa awaited him with its own set of adventures and wonders, and he was ready to embrace them.","[Canada, Canada, Canada, United States, United States, United States, Mexico, Mexico, Mexico, Australia, Australia, Australia, Japan, Japan, Japan, Japan, Norway, Norway, Norway, South Africa, Canada, Norway, South Africa]",18,1961
77,"John, an avid traveler from Canada, had recently returned from an exciting trip to Japan, a country he had always wanted to visit. He was mesmerized by Japan's rich history and unique culture and was intrigued by the stories he heard about the ancient samurai warriors of Japan. In his conversations with locals, he heard tales of the historic trade relations between Japan and China, and how both Japan and China had influenced each other's art, culture, and technological progress. Captivated by these historical narratives, John decided to take his next adventure to China. Upon reaching China, he was fascinated by the Great Wall, which served as a symbol of China's strength and resilience. The locals in China also shared stories about the Silk Road and how it connected China with Iran, leading to the exchange of goods, ideas, and culture. Intrigued by this, John penciled in Iran as his next destination. Upon his arrival in Iran, John was amazed by the grandeur of the Persepolis and the many tales of Iran's ancient civilizations. In Iran, he learned of the country's deep-rooted connections with Iraq, from the shared religious beliefs to the common history of the Persian Gulf. Curiosity piqued, John subsequently decided to visit Iraq. In Iraq, he witnessed the remnants of Babylon, illustrating Iraq's significance in world history. Iraq's historical narrative also emphasized its ties with Turkey, a country known for its rich history and diverse culture. John then mapped out his route to Turkey, eager to explore another chapter in the grand tale of interconnected nations. In Turkey, the grandeur of the Hagia Sophia awestruck him, sparking conversations about Turkey's unique position at the crossroads of Europe and Asia. Stories of Turkey's past reminded him of Greece's history, particularly Turkey and Greece's shared heritage and sometimes tumultuous coexistence. This made John eager to continue his historical exploration in Greece. The links that had drawn him from Canada to Japan, from there to China and Iran, and eventually to Iraq, Turkey, and Greece, reminded him of the intricate web of connections that made up human history.","[Canada, Japan, Japan, Japan, Japan, China, Japan, China, China, China, China, China, China, Iran, Iran, Iran, Iran, Iran, Iraq, Iraq, Iraq, Iraq, Iraq, Turkey, Turkey, Turkey, Turkey, Turkey, Greece, Turkey, Greece, Greece, Canada, Japan, China, Iran, Iraq, Turkey, Greece]",17,2161
78,"Jenny, a travel enthusiast from the United States, had a particularly fascinating story to tell about her time in Russia. She insisted that the more she traveled around Russia, the more it felt like she was navigating through a book of diverse and complex tales. She further mentioned that the art, culture, and history of Russia left a profound impact on her, making her visit all too memorable. Recently, she met Kazuo, a friend from Japan, who had a completely unique experience in Iran. He claimed Iran to be a nation of warm hospitality and stunning heritage, contrasting drastically with the public perception of Iran. Kazuo explained how Iran, despite controversies, held immense beauty and complex history that would surprise many. He also had a chance to explore Pakistan, and he found it equally diverse and intriguing. Each city in Pakistan, he noted, told a different story and held fascinating secrets that often went unnoticed in the world's eyes. Meanwhile, Jenny also had a fantastic experience during her visit to Australia. The wildlife, the landscapes, and the laid-back lifestyle of Australia were both thrilling and relaxing at the same time. She stated how Australia's natural beauty and its unique flora and fauna were truly captivating. Speaking of natural beauty, Jenny and Kazuo were both eager to visit Canada. Stories of the breathtaking landscapes, wildlife, and multicultural cities of Canada had always intrigued them. Canada, they believed, symbolized a perfect blend of urban life harmoniously co-existing with nature. After exchanging tales of travel and their shared yearning for Canada, they concluded that exploring different nations like Russia, Iran, Australia, and Pakistan opens doors to learning about diverse cultures, histories, and lifestyles. It was the shared understanding of the immense beauty each country held, and the desire to see more of the world that strengthened their bond.","[United States, Russia, Russia, Russia, Japan, Iran, Iran, Iran, Iran, Pakistan, Pakistan, Australia, Australia, Australia, Canada, Canada, Canada, Canada, Russia, Iran, Australia, Pakistan]",16,1931
79,"As a historian, Alice was fascinated by the ancient civilizations of Greece and Egypt. She loved reading about how scholars from Greece and Egypt exchanged ideas, contributing to the foundation of philosophical and mathematical thoughts. Alice, who was from the United States, had a longtime friend, Ying, from China. Ying, who studied ancient arts, was particularly interested in the historical links between China and Japan. She explained that the cultural exchanges between China and Japan had fostered a significant development in arts, religions, philosophy, and social organizations. It was evident that Alice and Ying shared a profound interest in the historical connections between countries. Alice, fondly reminiscing about her trip to Australia, mentioned its curious connection with New Zealand. She mentioned how Australia and New Zealand shared a similar culture and history, with both being colonies of the United Kingdom. Ying, reminded of her visit to South Korea, shared how she learned about the deep cultural and historical connections between North Korea and South Korea. Despite the current political divide, there was undeniable shared heritage and history between North Korea and South Korea. Both excitedly shared stories about their visit to Europe, Alice had been to Ireland and Ying had visited Poland. Alice brightened up talking about the shared culture of Ireland and the United Kingdom, while Ying shared her fascination with the rich history and cultural ties between Poland and Ukraine. As they connected these dots, they found themselves growing more passionate about history and decided to plan a trip to explore more connections around the world.","[Greece, Egypt, Greece, Egypt, United States, China, China, Japan, China, Japan, Australia, New Zealand, Australia, New Zealand, United Kingdom, South Korea, North Korea, South Korea, North Korea, South Korea, Ireland, Poland, Ireland, United Kingdom, Poland, Ukraine]",13,1682
80,"In the heartland of Argentina, a team of archaeologists unearthed ancient artifacts believed to have links to the indigenous cultures of Brazil. These artifacts were a testament to a historical bond between Argentina and Brazil, bonds that spanned commerce, culture, and shared histories. Intrigued by this, a historian from the United States began researching historical records, asserting there were similar cultural exchanges between United States and Canada. The evidence suggested that despite the political boundaries, the indigenous communities of the United States and Canada were interconnected in their beliefs, customs, and trading routes. This reminded the historian of his colleague from South Korea, who had dedicated her life to unraveling the historical ties between South Korea and North Korea. Despite modern tensions, she explained, the past of South Korea and North Korea was full of shared mythologies, philosophies, and even royal lineages. Recalling her work, the historian was encouraged to delve deeper into European histories, particularly of Poland and Ukraine. He discovered that Poland and Ukraine, despite distinct identities, shared common historical threads; they had alternately been allies or enemies over centuries, shaping each other's history. While exploring this, he stumbled upon an interesting account of Australia's relationship with New Zealand. Both Australia and New Zealand, isolated in the Pacific Ocean, had closely knit bonds since ancient times, with migration, trade, and even sports. The historian's wife, a botanist from Ireland, had her own tales to share; she had unearthed fascinating links between the native flora of Ireland and Scotland. The plants of Ireland and Scotland, she proposed, told a story of ancient land bridges and shared ecosystems. As they shared their findings, they marveled at the complex web of relationships that spanned from Argentina to Scotland, demonstrating the interconnectedness of our world's histories.","[Argentina, Brazil, Argentina, Brazil, United States, United States, Canada, United States, Canada, South Korea, South Korea, North Korea, South Korea, North Korea, Poland, Ukraine, Poland, Ukraine, Australia, New Zealand, Australia, New Zealand, Ireland, Ireland, Ireland, Argentina]",13,1991
