ID,Text,Countries,Sentences,Characters
45,"On a trip to Norway, Jake stumbled upon an old journal that mentioned a secret Viking expedition from Norway to Canada. It was believed that this expedition had taken place before the known explorations, involving a small group of Vikings from Norway who had discovered and briefly settled in Canada. Intrigued by this revelation, he shared the information with his friend Lucy, who lived in the United Kingdom. Lucy, an avid historian, excitedly recalled a similar story that originated in the United Kingdom, involving a clandestine journey to Australia. The United Kingdom, she explained, had a history of covert voyages to Australia in search of new territories and resources. Shifting the conversation, Lucy spoke about a book she'd recently read which gave detailed accounts of the complex relationship between Japan and China. This book claimed that in the ancient era, Japan and China had significant cultural exchanges and trade relations despite ongoing conflicts. She also mentioned the fascinating history of Iran and Iraq, two countries with intertwined destinities. Iran and Iraq, despite their political turbulence, had a shared historical and cultural legacy that often gets overlooked. Jake then added a story from his recent travels to Spain, where he learned about the country's ancient connections with Portugal. He explained that Spain and Portugal, though culturally distinct, had a shared maritime history that led to significant exchanges between the two. While on the topic of shared histories, Lucy mentioned her visit to Zimbabwe where she discovered the country's profound historical ties with South Africa. Zimbabwe and South Africa, she said, were bound together by a shared struggle for independence and a deep-rooted sense of brotherhood despite geographical boundaries. The conversation fueled their wanderlust, casting a light on the fascinating interconnectedness and shared legacies of countries spanning from Norway to South Africa.","[Norway, Norway, Canada, Norway, Canada, United Kingdom, United Kingdom, Australia, United Kingdom, Australia, Japan, China, Japan, China, Iran, Iraq, Iran, Iraq, Spain, Portugal, Spain, Portugal, Zimbabwe, South Africa, Zimbabwe, South Africa, Norway, South Africa]",14,1969
46,"Beginning her journey in France, Jane was mesmerized by the art and culture sensibilities that defined France. Intrigued by the architecture, history, and fashion that was distinctive of France, she was compelled to dig deeper into the historical ties that connected France with neighboring Italy. Italy, with its rich history and cultural heritage, shared an artistic bond with France, both historically and contemporarily. Jane next decided to visit South Africa, where she found a stark contrast to the art and sophistication of Italy, yet an enticing allure in the vibrant traditions and natural wonders that South Africa had to offer. The wildlife in South Africa, she found, was unmatched and the conversations she had with locals revealed tales of connections between South Africa and neighboring Zimbabwe. Zimbabwe, she learned, had been a trading partner with South Africa, their histories intertwining in ways she found fascinating. Next on her list was the United States, where she was taken by the diverse cultures and the sprawling metropolises. The technological advancements of the United States astounded her, and she was interested to learn about the political and economic ties between the United States and Canada. Canada, she found, held its unique charm, with its breathtaking landscapes and welcoming locals. She found out about the historical bond between Canada and the United Kingdom through her conversations. Finally, she ended her journey in the United Kingdom, where she was captivated by the rich history and architectural marvels. The United Kingdom had historic ties with Canada and it was fascinating to see the influence each country had on the other. This journey taught her a lot about the world and its intricate links, promising to revisit these countries and explore more connections.","[France, France, France, France, Italy, Italy, France, South Africa, Italy, South Africa, South Africa, South Africa, Zimbabwe, Zimbabwe, South Africa, United States, United States, United States, Canada, Canada, Canada, United Kingdom, United Kingdom, United Kingdom, Canada]",13,1823
47,"James, a historian, found himself engrossed in the medieval stories of knights from the United Kingdom, where armor and chivalry were the symbols of bravery. He was particularly interested in the historical ties between the United Kingdom and Ireland, how the two countries, despite their conflicted history, had shared traditions, myths, and legends. Inspired by these narratives, he wrote to his friend Rosa in Mexico, telling her about his research. Rosa, a linguistics expert, was intrigued and wrote back about the rich history of Mexico and the indigenous cultures that shaped the country. She also spoke about the vibrant traditions indigenous to Mexico and Peru, and how both Mexico and Peru had a shared history of ancient civilizations, with languages, rituals, and architecture that had a profound influence on their respective societies. She then shared about her trip to Russia, which she found so diverse and captivating. The historian in James was excited by the detailed descriptions Rosa gave about Russia and Ukraine, about their shared history, the influence of the Byzantine Empire, and the development of Cyrillic script. He then reminisced about his visit to South Africa where he explored the local folktales. He mentioned how South Africa and Zimbabwe's stories were intertwined, with themes of resilience and liberation echoing through their histories. Rosa responded, sharing her fascination with Japan and its unique cultural heritage. She wrote about Japan and South Korea, their shared past, cultural exchanges, and how they had influenced each other's art and literature. They both concluded that the fascinating journeys of these countries, from the United Kingdom to South Korea, suggested a world much more interconnected than generally perceived.","[United Kingdom, United Kingdom, Ireland, Mexico, Mexico, Mexico, Peru, Mexico, Peru, Russia, Russia, Ukraine, South Africa, South Africa, Zimbabwe, Japan, Japan, South Korea, United Kingdom, South Korea]",12,1780
48,"In the heart of Mexico, a historian named Marta unearthed a series of artifacts that were traced back to the ancient civilization of Peru. This led her to believe that during prehistoric times, there might have been a direct route from Mexico to Peru, allowing a fascinating exchange of ideas, cultures, and traditions. Thrilled by the discovery, she shared the information with her friend Leo, an anthropologist from the United States who had recently been studying cultural connections between the United States and Canada. Leo was intrigued as he had discovered similar links between the United States and Canada, suggesting that there might have been prehistoric connections between these seemingly distant regions. Leo then shared his recent study about the intriguing relationship between South Africa and Kenya. The two African nations, South Africa and Kenya, had a rich tapestry of legends suggesting a shared ancestry and rich cultural exchanges. Marta was reminded of a book she read about the historical ties between Russia and Ukraine. This book discussed extensive trade routes and cultural exchanges between Russia and Ukraine, adding another layer to their complicated history. Similarly, her team had recently found artifacts in Australia, which surprisingly pointed towards a connection with New Zealand. It seemed that Australia and New Zealand, despite being known for their unique isolated biodiversity, also shared a deep historical bond. Leo, smiling, told Marta that his recent visit to Italy had been enlightening as he learned of the ancient interactions between Italy and its neighbor, Greece. He explained that Italy and Greece, despite their renowned and distinct ancient cultures, had influential exchanges in art, language, and governance. Finally, they chatted about their shared trip to South Korea and North Korea where they had learned about the deep ties between the two nations. Their conversation was a testament to the intriguing web of connections between countries from Mexico to Greece and beyond, adding another dimension to the study of human history.","[Mexico, Peru, Mexico, Peru, United States, United States, Canada, United States, Canada, South Africa, Kenya, South Africa, Kenya, Russia, Ukraine, Russia, Ukraine, Australia, New Zealand, Australia, New Zealand, Italy, Italy, Greece, Italy, Greece, South Korea, North Korea, Mexico, Greece]",14,2095
49,"Alice, an archeologist from France, spent her career uncovering the ancient history between France and its neighboring country, Spain. She specialized in the medieval age, focusing particularly on the cross-cultural influences between France and Spain at the time. These nations shared a border and a rich, intertwined history, filled with wars, alliances, and cultural exchange. Her work in France led her to the involvement of another country, Italy, in this historic web. She launched an expedition to Italy, hoping to uncover clues about Italy's relation with Spain in the past. There, she discovered the influence of Italy on Spain's art and architecture during the Renaissance period. Alice's fascination with history drove her from Europe to the Middle East, focusing on the ancient civilizations of Iraq and Iran. She uncovered that Iraq and Iran, despite their modern political differences, share a vast historical connection dating back thousands of years. The Persian Empire, centered in Iran, and the Mesopotamian civilizations, centered in Iraq, had left indelible marks on each other. Alice's research also took her to East Asia, specifically to China and Japan. Alice was captivated by China's ancient dynasties and their influence on Japan through Buddhism and Confucianism. Her investigation revealed that China and Japan had a complex relationship spanning centuries, shaped by the exchange of ideas, trade, and occasional conflicts. Inspired by her findings, Alice decided to delve into the history of North and South America, focusing particularly on Mexico and the United States. She learned that Mexico and the United States shared a layered history, marked by conflicts, treaties, and profound cultural exchanges. The captivating tales of France, Spain, Italy, Iraq, Iran, China, Japan, Mexico, and the United States sparked an unforgettable journey across the globe for Alice, deepening her appreciation for the interconnectedness of the world's history.","[France, France, Spain, France, Spain, France, Italy, Italy, Italy, Spain, Italy, Spain, Iraq, Iran, Iraq, Iran, Iran, Iraq, China, Japan, China, Japan, China, Japan, Mexico, United States, Mexico, United States, France, Spain, Italy, Iraq, Iran, China, Japan, Mexico, United States]",15,1978
50,"Often in his dreams, James would find himself in the enchanting landscapes of Sweden, the country where his grandfather was born, raised, and met his grandmother. Stories of Sweden, of their meetings by the pristine lakes and under the northern lights, would always be his favorites. But his grandmother was from Norway, a land equally captivating with its fjords and vibrant cities. She too, had tales to narrate about Norway, featuring the midnight sun and her expeditions to the icy Svalbard. Curiosity piqued, James decided to visit these lands his grandparents hailed from, starting with a trip to Sweden and then making his way to Norway. In his travels, he befriended a fellow adventurer, Laura, who was from the United States and on a similar journey. Laura, like James, was tracing her roots that lay in the heart of the United States where her parents ran a farm. Yet, she was also fascinated by the history of United Kingdom, the birthplace of her paternal grandparents. She would revisit stories her grandparents spun about United Kingdom, its beautiful countryside and bustling cities, the ancient monuments and the modern marvels. It struck James that while he was drawn towards Sweden and Norway, his grandparents' childhood homes, Laura was drawn towards the United States and United Kingdom, where her family's history was rooted. Sharing stories, they soon found common ground in their love for Canada, a place they had both visited during their respective journeys. They laughed over shared memories of Canada, of the breathtaking wilderness, the cosmopolitan cities, and the kind locals, and made plans for a future visit to Canada together. As they continued their explorations, their respect for the past deepened, and their hearts filled with gratitude for the present, realizing the interconnections of countries from Sweden to Canada.","[Sweden, Sweden, Norway, Norway, Sweden, Norway, United States, United States, United Kingdom, United Kingdom, Sweden, Norway, United States, United Kingdom, Canada, Canada, Canada, Sweden, Canada]",13,1859
51,"Sophie, an avid traveler and photographer, had recently visited the naturally diverse landscapes of Canada. She was particularly struck by the wildlife in Canada, where she had the rare opportunity to photograph the grizzly bears and orcas. Inspired by her experiences in Canada, she decided to plan her next adventure to Australia, known for its unique flora and fauna. She had always dreamed of photographing the kangaroos and koalas that Australia is famous for. With the memories of Canada still fresh and the anticipation for Australia building, she started sorting through her photographs from her trip to South Africa. She remembered the breathtaking sunrises she had captured in South Africa and the wild Safari experiences where she got close to the Big Five animals. After South Africa, her journey took her to New Zealand, where she was truly enchanted by the magical landscapes. The mountains and the clear blue waters of New Zealand had left a deep imprint on her soul. While reminiscing about her past travels, she remembered her unforgettable journey to Brazil when she had covered the carnival and the vibrant life of the people there. She loved the music and the street art of Brazil and the country's spirit of celebration. She then recalled her time in Mexico, where she was fascinated by the ancient Maya and Aztec civilizations. The diverse culture and the colorful festivals of Mexico were something she would never forget. With these beautiful memories in mind, she was also looking forward to her upcoming visit to Japan. She was particularly excited to witness the cherry blossom festival in Japan and capture the stunning pink hues that blanket the country during spring. Recalling the thrill she felt every time she stepped into a new country, from Canada to Japan, she started packing for her next adventure to Australia. As she packed, she held close the experiences she had gathered so far and looked forward to creating new ones.","[Canada, Canada, Canada, Australia, Australia, Canada, Australia, South Africa, South Africa, South Africa, New Zealand, New Zealand, Brazil, Brazil, Mexico, Mexico, Japan, Japan, Canada, Japan, Australia]",16,1960
52,"Robert, an experienced traveler, decided to narrate tales of his adventures in Brazil and Argentina to his friends at a cozy get-together. He described the vibrant culture in Brazil, the passionate people, and how his journey took him all the way to Argentina, where he was welcomed by the warm locals. His descriptions of Argentina and Brazil made his friends eager to hear more about his travels. Next, he took them on a verbal tour of Japan and China, two countries he had visited repeatedly due to their rich histories and contrasting cultures. Robert described the tranquility he experienced in Japan, followed by the bustling energy he witnessed in China - a country with ancient roots and a bright future. China, he mused, was a country of contrasts much like Japan, with its fusion of tradition and modernity. Struck by his tales, one of his friends, Sarah, shared her experiences from her visit to Russia and Ukraine. Sarah expressed how despite the harsh winters in Russia, the warmth of the people was unforgettable, and how moving across the border to Ukraine, she was amazed by the shared history but distinct identities of the two nations. Unlike Russia, Ukraine had a different atmosphere, yet there were undeniable shared experiences between the two nations. Next, their friend James chimed in about his time in Italy and France. As an art lover, James found Italy to be his paradise, filled with awe-inspiring architecture and art. He then journeyed to France, where he was equally enchanted by the art scene and the shared passion for art between Italy and France. The evening ended with everyone vowing to travel more, from Brazil to France, inspired by the shared stories and the cross-cultural bonds that tie the world together.","[Brazil, Argentina, Brazil, Argentina, Argentina, Brazil, Japan, China, Japan, China, China, Japan, Russia, Ukraine, Russia, Ukraine, Russia, Ukraine, Italy, France, Italy, France, Italy, France, Brazil, France]",13,1749
53,"John, an archaeologist based in Australia, recently discovered a connection between artifacts found in his home country and those discovered in South Africa. This fascinating link between Australia and South Africa had never been explored before and offered a new perspective on ancient trade routes. Inspired by this discovery, John reached out to his colleague, Sarah, in Canada. Sarah was a leading expert in ancient civilizations and had been studying long-lost connections between Canada and the United Kingdom. Drawing parallels between the cultures of Canada and the United Kingdom, Sarah explained how shared cultural symbols suggested ancient migratory patterns. Meanwhile, in South Korea, a curious historian named Lee had uncovered records from North Korea, detailing ancient diplomatic ties with China. These documents showed that North Korea and China had shared a significant cross-border exchange in the past, influencing the culture of both nations. Intrigued by these findings, Lee reached out to his colleague in Russia, Elena, who had recently been studying the historical association between Russia and Ukraine. Elena had found evidence that Russia and Ukraine, despite their turbulent history, had once shared a mutually beneficial trade relationship. John, Sarah, and Elena, and Lee decided to publish their findings together, sharing their unique insights into the historical connections between Australia and South Korea, Canada and the United Kingdom, and Russia and Ukraine. A celebrated historian from Sweden, Olaf, upon reading their research, was reminded of the ancient connections between Sweden and Norway. Sweden and Norway, being closely situated, had a history of deep cultural and social exchanges. As they all delved deeper into their research, they realized how interconnected the world truly was, from Australia to Sweden, and how history echoed through the ages in surprising and fascinating ways.","[Australia, South Africa, Australia, South Africa, Canada, Canada, United Kingdom, Canada, United Kingdom, South Korea, North Korea, China, North Korea, China, Russia, Russia, Ukraine, Russia, Ukraine, Australia, South Korea, Canada, United Kingdom, Russia, Ukraine, Sweden, Sweden, Norway, Sweden, Norway, Australia, Sweden]",13,1937
54,"When Lara visited Spain, she was drawn to the stories of the local people, their traditions, and history. Spain, with its rich culture, was a treasure trove for Lara, who was an anthropologist from Sweden. She found that the architecture in Spain bore a striking resemblance to the structures she had seen in Italy, leading her to delve into the historical connections between Spain and Italy. While in Italy, she also explored its ties with neighboring France, learning about the shared histories, cultural exchanges, and rivalries that shaped the identities of these two countries. Lara's fascination with cultural connections did not stop there; she traveled to Argentina, where she found it intriguing how the country's history was intertwined with Brazil. It was intriguing how Argentina and Brazil, despite historical conflicts, managed to share music, dance forms, and food traditions. Her journey then took her to the United States where she learned about its historical ties with Canada. The United States and Canada, she found, had a history of peaceful coexistence and cooperation despite the occasional disputes. In the Middle East, she explored the deep-rooted historical connections between Iran and Iraq. She discovered that these countries, Iran and Iraq, despite modern-day conflicts, shared a rich history of cultural and economic exchanges. Lara's last trip was to Australia, where she explored its ties with neighboring New Zealand. The closeness between Australia and New Zealand, she found, went beyond geography and was deeply etched in their shared history and culture. As Lara journeyed from Spain to Australia, she found herself marvelling at the way these countries, despite their differences, were interconnected through history and culture.","[Spain, Spain, Sweden, Spain, Italy, Spain, Italy, Italy, France, Argentina, Brazil, Argentina, Brazil, United States, Canada, United States, Canada, Iran, Iraq, Iran, Iraq, Australia, New Zealand, Australia, New Zealand, Spain, Australia]",13,1769
55,"John, an historian from Mexico, always had a fascination for the ancient civilizations of Egypt. His interest in Egypt ignited when he discovered that there were ties between the Mesoamerican cultures of Mexico and the ancient dynasties of Egypt, possibly through a network of trade routes lost to the annals of history. His research led him to Italy, famous for its connection to Greece through shared mythology and cultural exchanges. He was intrigued to learn that both Italy and Greece, despite being separate nations, had histories that were intertwined and filled with shared tales of heroism and mythological gods. His interests soon expanded to the Far East, focusing on South Korea and its neighbor, North Korea, despite the political standoff between the two. He learned that South Korea and North Korea, both with a common past, presented a stark contrast in their modern development paths. On his return from Asia, he made a stopover in Ireland and was captivated by the country's rich folklore and legends. Intriguingly, the historical ties between Ireland and the United Kingdom were far more complex than he had assumed, showcasing a mix of conflict and cooperation that had shaped the destinies of both nations. His next stop was the United States, with its vast melting pot of cultures and its dynamic history. Specifically, he was drawn to the deep-rooted cultural and historical links between the United States and Canada that depict a story of neighborly relations, shared values, and common defense interests. Lastly, he found himself in the Middle East, exploring the intricate relationship between Iran and Iraq that spanned millennia. Despite their modern conflicts, he was surprised to find that both Iran and Iraq shared a long history of cultural exchanges, even during periods of strife. His journey, touching on countries from Mexico to Iraq, was a testament to the intricate web of connections historic and modern societies share.","[Mexico, Egypt, Egypt, Mexico, Egypt, Italy, Greece, Italy, Greece, South Korea, North Korea, South Korea, North Korea, Ireland, Ireland, United Kingdom, United States, United States, Canada, Iran, Iraq, Iran, Iraq, Mexico, Iraq]",13,1960
56,"During his adventures in Brazil, Jack discovered an ancient map detailing trade routes between Brazil and Argentina. The map indicated that spices, precious metals, and unique textiles were frequently traded between Brazil and Argentina, highlighting their historical connection. Intrigued, he shared his discovery with his historian buddy, Mike, who lives in Canada. Mike reminded him of the notable similarities between such trade accounts and the historical exchanges between the United Kingdom and Ireland, both of which had profound cultural and economic influences on each other. They also recalled a famous book detailing the fascinating expeditions linking South Africa with Australia. The book portrayed their marine adventures, unraveling the rich biodiversity found in both South Africa and Australia's marine ecosystems. Their discussion shifted to the lively bazaars of Pakistan, remembered by Jack from his past travels. He elaborated on the apparent cultural crossovers between Pakistan and Iran, evident from their cuisine, music, and architectural styles. Mike, moved by this story, reminisced on his trip to Sweden. He narrated his experiences about the historic and cultural ties between Sweden and its neighboring country, Norway, deeply rooted in their shared Viking heritage. The conversation then drifted towards the East, to the land of the rising sun, Japan. They discussed the influence Japan had on South Korea and vice versa, especially in areas such as technology and pop culture. Fascinated with these tales of global connections, they reflected upon how countries, from Brazil to Japan, have shared rich histories, thus knitting a beautiful tapestry of human legacy.","[Brazil, Brazil, Argentina, Brazil, Argentina, Canada, United Kingdom, Ireland, South Africa, Australia, South Africa, Australia, Pakistan, Pakistan, Iran, Sweden, Sweden, Norway, Japan, Japan, South Korea, Brazil, Japan]",13,1697
