ID,Text,Countries,Sentences,Characters
23,"Lucas, an avid traveler from Canada, had recently returned from his excursion in Norway. In Norway, he had heard tales of ancient Vikings, their voyages and their mysterious connection with Ireland. Intriguingly, these legends suggested that some of these Vikings had not only raided but settled in parts of Ireland, influencing its early history. Lucas was fascinated by these stories and shared them with his friend Sofia, who hailed from Brazil. Sofia, fascinated, narrated her own experiences in Mexico where she had learned about the historical links between her native Brazil and Mexico. Both Brazil and Mexico, despite their geographical distance, shared legends of ancient gods and mythical creatures. Intriguingly, she mentioned the tales from New Zealand she had heard during her travels. Similar to Mexico and Brazil, New Zealand had its share of mythologies, but what fascinated her was the more modern link between the two regions - New Zealand and Australia. New Zealand, just like Australia, was known for its wild, untouched landscapes and unique wildlife. Their conversation then turned to the memories of her trip to Egypt. In Egypt, Sofia had learned about the once powerful empire’s relations with its neighbor Israel. The two countries - Egypt and Israel - had an intricate, complex history relationship spanning over thousands of years. Shifting gears, Lucas then shared his experiences from Vietnam, particularly the rich historical connections between Vietnam and its neighbor China. Just like Israel and Egypt, Vietnam and China had their share of ancient histories and conflicts, shaping the countries as they were today. Their exchange of travel tales and cultural learnings proved to be a fascinating journey itself, moving from Canada to China, and witnessing the rich, interwoven histories of the world.","[Canada, Norway, Norway, Ireland, Ireland, Brazil, Mexico, Brazil, Mexico, Brazil, Mexico, New Zealand, Mexico, Brazil, New Zealand, New Zealand, Australia, New Zealand, Australia, Egypt, Egypt, Israel, Egypt, Israel, Vietnam, Vietnam, China, Israel, Egypt, Vietnam, China, Canada, China]",15,1833
24,"Joan, a historian from the United States, stumbled upon an ancient journal detailing the age-old trade relations between Canada and the United States. She was intrigued to find how inhabitants from both Canada and the United States took perilous journeys across the border to exchange goods and knowledge. Keen to share this, she contacted her friend Lars, a fellow historian from Sweden, who had also been studying the ties between Norway and Sweden for years. Based on his research, he found that the Vikings from both Norway and Sweden embarked on several maritime expeditions together, revealing the profound connections between these two nations. Their conversation shifted towards the East when Lars shared his fascination with the historical links between China and Japan. He pointed out that despite their conflicting histories, China and Japan had significant cultural influences on each other, dating back to centuries. Joan, intrigued by Asia, mentioned her recent trip to South Korea, where she learned about the age-old diplomatic and cultural links between North Korea and South Korea. Despite the current political divide, North Korea and South Korea share deep cultural roots that could be traced back to ancient dynasties. This reminded Lars of his journey to Israel, where he gained insight into the complex history between Israel and Iran. The journal he had come across in Israel cited instances from the past when trade and diplomatic relations between Israel and Iran were prevalent. They ended their conversation reflecting on the interconnectedness of nations, from Canada to Iran, how despite their distinct identities, their paths had intertwined in the annals of history.","[United States, Canada, United States, Canada, United States, Sweden, Norway, Sweden, Norway, Sweden, China, Japan, China, Japan, South Korea, North Korea, South Korea, North Korea, South Korea, Israel, Israel, Iran, Israel, Israel, Iran, Canada, Iran]",11,1698
25,"Robert, an avid bird watcher from Canada, packed his bags for his most awaited trip to Brazil. He aimed to explore the biodiversity of Brazil, especially the bird species endemic to the region. His trip to Brazil was an eye-opener as he marveled at the varied and vibrant birds he saw, some of which were critically endangered. After a successful expedition in Brazil, his next stop was Australia. He was thrilled to observe the distinctive bird species in Australia, such as the Emu and the Kookaburra, that make Australia a paradise for bird watchers. Australia, he discovered, also had a significant number of migratory birds that added to its rich diversity. His next destination was South Africa, a country known for its unique fauna. He spent several days in South Africa, amazed by the incredible diversity and uniqueness of its bird species. Not only were the birds in South Africa unique, but also the landscape was breathtaking. From South Africa, Robert set off for his next adventure in Vietnam. He discovered that Vietnam bore a diverse range of habitats that are home to various bird species. The bird species in Vietnam, he concluded, make the country a bird watcher's paradise. His final stop was France, known for its rich cultural heritage and gastronomy. In France, he observed a range of fascinating birds, each species as unique and captivating as the country itself. France, he noted, is not only a treasure trove of historical and cultural richness but also holds a significant number of bird species. As he reflected on his trips from Canada to France, Robert felt grateful for these experiences that allowed him to appreciate the diverse bird species each country had to offer.","[Canada, Brazil, Brazil, Brazil, Brazil, Australia, Australia, Australia, Australia, South Africa, South Africa, South Africa, South Africa, Vietnam, Vietnam, Vietnam, France, France, France, Canada, France]",16,1702
26,"John, an avid traveler from Canada, had recently returned from a remarkable trip to Australia. During his time in Australia, he was introduced to the country's ancient aboriginal culture and traditions, which had a profound impact on him. His fascination grew so much that he decided to share his experiences with his childhood friend, Lucy, who was living in the United States. Lucy, intrigued by John's experiences in Australia, shared stories of her own travels to Mexico. Mexico, she said, was a country rich in history, boasting enigmatic pyramids and ancient civilizations that rivalled even those of Egypt. She recounted her adventures in Mexico, detailing the vibrant colors, the cuisine, and the generosity of the locals she had encountered. This conversation led John to recall his journey to Russia, where he had been especially fascinated by the grand palaces and the resilient spirit of the local people. Russia, he said, was a country that held countless stories in its vast stretches of land. Lucy, listening intently, mentioned her expedition to South Africa. It was in South Africa where she had seen the majestic African wildlife and met the diverse communities that called the nation home. She went on about her time in South Africa, noting how the country's challenges were as immense as its inspiring landscapes. John, in response, shared his experience in Japan. He talked about the harmonic blend of Japan's past and future, its cherry-blossom-lined streets, and its bustling urban areas. Japan, he concluded, was a country that treasured both its history and its future. Sharing their adventures, they reveled in the wonder of exploration and the rich diversity of cultures from Canada to Japan.","[Canada, Australia, Australia, United States, Australia, Mexico, Mexico, Egypt, Mexico, Russia, Russia, South Africa, South Africa, South Africa, Japan, Japan, Japan, Canada, Japan]",15,1719
27,"Lucia, an adventurous globetrotter from Argentina, had an insatiable curiosity about the ancient connections between Argentina and Brazil. She had heard tales of a secret path between Argentina and Brazil that the indigenous people used for trade and escape during conflicts. Her interest piqued, she embarked on a journey to South Korea to meet an old historian who specialized in ancient globalization. The historian shared with her intriguing stories about the ancient relationship between South Korea and China, involving wars, trade, and cultural exchanges. Specifically, he highlighted stories of South Korea sending tributary missions to the court of China, deepening her understanding of the intricacies of ancient relations. These stories from South Korea and China fascinated Lucia, prompting her to plan her next adventure to Norway. In Norway, she met with a renowned archaeologist who offered insights into the historical ties between Norway and Sweden. These ranged from the Viking ages, when Norway and Sweden were often in conflict, to the union period when they were under the same monarch. Lucia couldn't help but connect these inter-country relationships to those between Egypt and Israel. She had heard that Egypt and Israel had shared a tumultuous history marked by conflicts and peace treaties. As she delved into the historical records of Egypt and Israel, she found out about the fascinating dynamics of their past relations, painting a complex picture of friendship, rivalry, and everything in between. Reflecting on her global expeditions, Lucia mused about the rich and diverse histories of countries from Argentina to Israel and how their interconnections form a global tapestry of human civilization.","[Argentina, Argentina, Brazil, Argentina, Brazil, South Korea, South Korea, China, South Korea, China, South Korea, China, Norway, Norway, Norway, Sweden, Norway, Sweden, Egypt, Israel, Egypt, Israel, Egypt, Israel, Argentina, Israel]",12,1729
28,"It was a bustling afternoon in the local market of South Korea, as Liam, a historian from Australia, was talking to a shopkeeper about the local lore. The shopkeeper shared tales about the history of South Korea and its cultural exchange with Russia, their distant neighbor. He said that it was not uncommon for traders from South Korea to travel to Russia for trade, despite the geographical distance and harsh climatic conditions. Intrigued, Liam shared this story with his friend, Emma, who was in Japan, conducting some anthropological research. Emma narrated her encounters in Japan, about the deep cultural influences from China, which had significantly shaped Japan in the past. Both Japan and China, she said, had a rich history of cultural exchange, ranging from art and literature to philosophy and religion. The conversation reminded Liam of his research in Argentina, where he had discovered similar historic ties with Brazil. He described how Argentina and Brazil, in spite of political differences, have shared a rich cultural and historical connection since ancient times. Emma, in response, mentioned her time in Mexico, reminiscing about the cultural similarities she found with its neighbor, the United States. Both Mexico and the United States, she claimed, had histories strongly intertwined by migrations, trade, and shared cultural influences. It fascinated them both how far apart countries like Australia and the United States, or close neighbors like Japan and China, were all threads in the intricate tapestry of global history.","[South Korea, Australia, South Korea, Russia, South Korea, Russia, Japan, Japan, China, Japan, Japan, China, Argentina, Brazil, Argentina, Brazil, Mexico, United States, Mexico, United States, Australia, United States, Japan, China]",11,1554
29,"Eva, an historian from Poland, was working on uncovering the story of a secret society from Ukraine. This society, according to the chronicles she found in Poland, was said to have originated from Ukraine and established a network of operations in various European nations. Intrigued, she decided to collaborate with her colleague, Adam, from Norway who specialized in societies like these. Adam was fascinated with the historical connection between Norway and Sweden, often speaking about the Viking roots that influenced both nations. He believed that the society from Ukraine may have also touched Norway and Sweden, given their close geographical proximity and shared cultural elements. Their research got a surprising twist when they discovered an old map, possibly hinting at the society's reach to the United States. Detailed around the map were accounts of clandestine operations carried out by the society, extending from the United States to Canada. The United States and Canada, owing to their geographical closeness and shared history, seemed like a plausible area of influence for this secret society. Their bond deepened when Eva shared her research about the society's ties with Argentina. She postulated that members from Argentina and Brazil could have been part of the society, due to certain cryptic symbols found in the ruins of both Argentina and Brazil. As their work progressed, they stumbled upon clues pointing towards the society's presence in the Middle East - specifically Iraq and Iran. It seemed, as confirmed from records found in Iraq, that through a series of underground networks, the society managed to infiltrate regions as far as Iran. As they delved deeper, they marveled at the society's widespread reach, from Poland to Iran, their narrative spun across continents and centuries to create an enthralling tale of history.","[Poland, Ukraine, Poland, Ukraine, Norway, Norway, Sweden, Ukraine, Norway, Sweden, United States, United States, Canada, United States, Canada, Argentina, Argentina, Brazil, Argentina, Brazil, Iraq, Iran, Iraq, Iran, Poland, Iran]",13,1860
30,"John, an eminent historian from South Africa, was intrigued by the ancient tribes of Australia, whose unique cultural practices presented a rich historical tapestry. He observed a striking similarity between the indigenous cultures of Australia and South Africa, despite being geographically distant. His fascination led him to the United Kingdom, where he dove into the country's vast archives. Here, he unearthed records that illustrated the historical interactions between the United Kingdom and Australia during the colonial era. His research led him to Canada, drawn to the shared colonial histories between Canada and the United Kingdom. Interestingly, both Canada and the United Kingdom had experienced similar cultural transformations post-independence. His next stop was Brazil, a country known for its diverse cultural influences. He found intriguing parallels between the indigenous cultures of Brazil and Australia, opening new vistas for his research. Meanwhile, Maria, a sociologist from Poland, was exploring the unique cultural fabric of Ukraine. Her research highlighted the historic ties between Poland and Ukraine, two countries that shared borders and histories. Her work took her to the United States, a melting pot of cultures, where she discovered tales of immigration from Poland that heralded a new chapter in the history of the United States. She also studied the close political connections between the United States and Ukraine, unravelling the intricate web of international relations. Together, John in South Africa and Maria in Poland, though miles apart, were uncovering the hidden threads of our global tapestry, from Australia to Ukraine, revealing how history weaves us all together.","[South Africa, Australia, Australia, South Africa, United Kingdom, United Kingdom, Australia, Canada, Canada, United Kingdom, Canada, United Kingdom, Brazil, Brazil, Australia, Poland, Ukraine, Poland, Ukraine, United States, Poland, United States, United States, Ukraine, South Africa, Poland, Australia, Ukraine]",13,1718
31,"As a renowned anthropologist, Alice had journeyed to every continent, but her heart always returned to India. Within India, she had explored the lively markets, sacred temples, and remote villages, each more captivating than the last. After years of fieldwork in India, she had recently turned her attention to the musical traditions of Iran. Mesmerized by the distinctive melodies and rhythms, she found in Iran an entirely different cultural fabric woven with time. In Iran, she learned about the ancient tradition of storytelling through music, echoing the enchanting tales she had heard in China. The folk tales from China often shared elements with those from Vietnam, a country she was now eager to explore. She recalled her visits to Vietnam where she had discovered a vibrant culture rich in history and tradition. Her journeys took her from India to Vietnam but it was the deep connections between the people that fascinated her the most. Drawn by art and culture, she planned to spend her next summer in France exploring the local museums. In France, she hoped to uncover links to the artistic movements in Italy. While Italy was renowned for its Renaissance art, she found that France and Italy shared a mutual influence in the world of impressionist art. After France, Italy was next on her list. Alice had always been enchanted by the history of Italy, which was steeped in art, architecture, cuisine, and music. Having studied the cultural links between France and Italy, she was also eager to explore the connection between the United Kingdom and Ireland. She had read about the shared history, the shifting boundaries, and intertwined cultures of the United Kingdom and Ireland. As her thoughts wandered from the bustling streets of India, through the rhythmic heart of Iran, and over to the picturesque landscapes of Italy, her mind spun with anticipation for what the future held in Ireland. Each journey fuelled her curiosity and deepened her understanding, as she followed the intricate web of culture and history that spanned from India to Ireland.","[India, India, India, Iran, Iran, Iran, China, China, Vietnam, Vietnam, India, Vietnam, France, France, Italy, Italy, France, Italy, France, Italy, Italy, France, Italy, United Kingdom, Ireland, United Kingdom, Ireland, India, Iran, Italy, Ireland, India, Ireland]",17,2069
32,"Tom, a history scholar in the United Kingdom, had always been enraptured by tales of bygone eras, particularly those involving trade and cultural exchange. One day, he stumbled upon a curious old map from Iraq. This map documented ancient trade routes between Iraq and Iran, revealing a deep sense of camaraderie between these historic rivals. Excited by this discovery, he shared these maps with his friend, Carla, in the United States, who was an anthropologist researching the cultural influences in North America. Carla was excited to tell him about her recent findings about the interactions between Canada and the United States, specifically during the times of the fur trade. She mentioned how the United States and Canada had shared not just borders, but histories, economies, and even conflicts. The exchange of ideas triggered Tom's memory about Australia's rapport with New Zealand, as he had once read about their shared history in an old manuscript. He told Carla about this, noting how Australia and New Zealand had fought together in wars, pioneered in the sheep farming industry, and even shared a similar passion for rugby. Carla reciprocated the excitement and brought up her research on South Korea and Japan, detailing the cultural give-and-take between the two East Asian nations. While there were numerous historical conflicts between South Korea and Japan, there was also an undeniable exchange of ideas, trends, and even cuisines. Their conversation took a detour to Europe, specifically France and Italy, as Tom remembered the documented cultural interactions he had studied. Here, France and Italy, despite being known for their unique contributions to art and cuisine, had shared a long history of influences on each other. Their discussion made them reflect on the interconnectedness of nations, from the United Kingdom to Italy, and how cultural exchanges made the world a tapestry of shared histories.","[United Kingdom, Iraq, Iraq, Iran, United States, Canada, United States, United States, Canada, Australia, New Zealand, Australia, New Zealand, South Korea, Japan, South Korea, Japan, France, Italy, France, Italy, United Kingdom, Italy]",13,1931
33,"On a summer vacation, Jane, an archeology enthusiast from the United Kingdom, decided to embark on a journey to Egypt to explore the mystical pyramids. This fascination had been ignited by her reading about the ancient civilizations of Egypt, specifically the Pharaohs and their majestic reign. She also held a deep interest in the historical ties between the United Kingdom and India during colonial times, drawn by the cultural exchanges and conflicts that moulded both nations. Her journey to India was transformative, as she discovered the myriad influences from ancient civilizations like China that had left a profound impact on India's rich tapestry of history. Captivated by these transboundary influences, Jane thought of her friend Larry, a historian from Canada, who had done extensive research on trade relations between China and North Korea. According to Larry, China and North Korea, despite their political differences, share a vibrant history of trade and mutual influences, which he discovered during his visits. This reminded Jane of her trip to Argentina, where she learned about the historical relations between Argentina and Brazil. She was intrigued by how Argentina and Brazil, despite their geographical proximity, had distinct cultural identities interwoven with shared histories. This led her to envisage her next destination, the quaint and picturesque country of Norway, known for its ties with Sweden. Norway and Sweden, she knew, had a shared history as well as a unique cultural differentiation which she was excited to experience firsthand. As she wandered through the streets of Norway, Jane couldn't help but think about her childhood trip to Australia and its relations with New Zealand. The way Australia and New Zealand have constantly influenced each other, she reflected, was a testament to the connections forged by sharing a region. Her adventure affirmed to Jane that despite distances, countries from Egypt to Australia are bound by shared histories and cultural reciprocities.","[United Kingdom, Egypt, Egypt, United Kingdom, India, India, China, India, Canada, China, North Korea, China, North Korea, Argentina, Argentina, Brazil, Argentina, Brazil, Norway, Sweden, Norway, Sweden, Norway, Australia, New Zealand, Australia, New Zealand, Egypt, Australia]",13,2021
34,"In her recent journey, Lisa, an adventurous traveler from the United States, was fascinated by the similarities she noticed between indigenous art forms from Australia and New Zealand. She found that story-telling through art was a common practice among the native people of both Australia and New Zealand, a captivating way to pass down their rich cultural heritage through generations. Intrigued by this, she contacted her good friend, Robert, who had spent many years studying and exploring both South Africa and Kenya. Robert told her about the strong tribal culture in South Africa and Kenya, where art was not just an expression, but a way of life. He also shared heartwarming stories about his travels through the lesser-known parts of India and Pakistan. Robert explained that despite the political differences, India and Pakistan shared a rich tapestry of history and culture that was evident in their food, music, and traditional wear. Interested in this common cultural thread, Lisa recalled her experiences in Portugal and Spain, how the architecture, music, and food in both Portugal and Spain were influenced by centuries of shared history. Then, she asked Robert about his travels to North Korea and South Korea. Robert shared his observations about North Korea and South Korea, how despite the division, the shared roots reflected in their traditions, language, and festivals. Lisa then shared her memories of her trip to Brazil and Argentina. She marveled at how the indigenous cultures of both Brazil and Argentina had shaped vibrant festivals, music, and dance that were celebrated with great fervor. In the end, they both agreed that the cultures, traditions, and histories of countries from Australia to Argentina were beautifully intertwined, forming an intricate tapestry of shared human experiences.","[United States, Australia, New Zealand, Australia, New Zealand, South Africa, Kenya, South Africa, Kenya, India, Pakistan, India, Pakistan, Portugal, Spain, Portugal, Spain, North Korea, South Korea, North Korea, South Korea, Brazil, Argentina, Brazil, Argentina, Australia, Argentina]",12,1823
